{"binaries":{"python3":"Python 3.14.4","sbx":"v0.42.1 cc6e400a4a3ce3ce5e0b2b77b8ee352aac854c64"},"checkedAt":"2026-09-16T01:30:54.0342390Z","checks":{"abnormalExitRecovery":{"evidenceHash":"43181D5A69A9BEA53CF3328CD0E03E49920F50A647BA1FE40D166215B792A210","evidencePath":"../../../../docs/records/experiments/2026-09-16-v3-task8a-probe.md","verdict":"verified"},"daemonDisconnect":{"evidenceHash":"43181D5A69A9BEA53CF3328CD0E03E49920F50A647BA1FE40D166215B792A210","evidencePath":"../../../../docs/records/experiments/2026-09-16-v3-task8a-probe.md","verdict":"unverified"},"daemonHealthAndTemplate":{"evidenceHash":"43181D5A69A9BEA53CF3328CD0E03E49920F50A647BA1FE40D166215B792A210","evidencePath":"../../../../docs/records/experiments/2026-09-16-v3-task8a-probe.md","verdict":"verified"},"hostPathIsolation":{"evidenceHash":"049EBC16FD82B3B8A3E397737C5CEEB67C188F326118ACBCDC004526D0232EFF","evidencePath":"../../../../docs/records/experiments/2026-09-14-v3-capability-test-methods.md","verdict":"verified"},"limitsAndTransport":{"evidenceHash":"049EBC16FD82B3B8A3E397737C5CEEB67C188F326118ACBCDC004526D0232EFF","evidencePath":"../../../../docs/records/experiments/2026-09-14-v3-capability-test-methods.md","verdict":"verified"},"noWorkspaceNoSkillsNoMcp":{"evidenceHash":"43181D5A69A9BEA53CF3328CD0E03E49920F50A647BA1FE40D166215B792A210","evidencePath":"../../../../docs/records/experiments/2026-09-16-v3-task8a-probe.md","verdict":"verified"},"replayNetworkDeny":{"evidenceHash":"049EBC16FD82B3B8A3E397737C5CEEB67C188F326118ACBCDC004526D0232EFF","evidencePath":"../../../../docs/records/experiments/2026-09-14-v3-capability-test-methods.md","verdict":"verified"},"resourceAndOutsideStop":{"evidenceHash":"049EBC16FD82B3B8A3E397737C5CEEB67C188F326118ACBCDC004526D0232EFF","evidencePath":"../../../../docs/records/experiments/2026-09-14-v3-capability-test-methods.md","verdict":"verified"}},"profileHash":"66A6A4B01BA9456AC4472BA813681FE1D3760D00EECF4F2E352E2C73E3740DD9","schemaVersion":3,"transportContrast":{"clientKilled":{"exitCode":null,"stderrKind":"none-client-killed-by-outside"},"exit0":{"exitCode":0,"stderrKind":"empty"},"exit127":{"exitCode":127,"stderrKind":"shell-not-found"},"exit7":{"exitCode":7,"stderrKind":"empty"},"timeout":{"exitCode":null,"stderrKind":"none-client-killed-by-outside"}}}
