{"binaries":{"codex":"codex-cli 0.149.1","python3":"Python 3.14.4","sbx":"v0.42.1 cc6e400a4a3ce3ce5e0b2b77b8ee352aac854c64"},"checkedAt":"2026-09-17T02:27:32.6861179Z","checks":{"abnormalExitRecovery":{"evidenceHash":"7F243BBE9E49711D3374C95F270DFB19FB02D358C6B12BE241C7D1304A194723","evidencePath":"../../../../docs/records/experiments/2026-09-17-task9-codex-template-evidence.md","verdict":"verified"},"credentialMethod":{"evidenceHash":"7F243BBE9E49711D3374C95F270DFB19FB02D358C6B12BE241C7D1304A194723","evidencePath":"../../../../docs/records/experiments/2026-09-17-task9-codex-template-evidence.md","verdict":"verified"},"daemonDisconnect":{"evidenceHash":"7F243BBE9E49711D3374C95F270DFB19FB02D358C6B12BE241C7D1304A194723","evidencePath":"../../../../docs/records/experiments/2026-09-17-task9-codex-template-evidence.md","verdict":"unverified"},"daemonHealthAndTemplate":{"evidenceHash":"7F243BBE9E49711D3374C95F270DFB19FB02D358C6B12BE241C7D1304A194723","evidencePath":"../../../../docs/records/experiments/2026-09-17-task9-codex-template-evidence.md","verdict":"verified"},"hostPathIsolation":{"evidenceHash":"7F243BBE9E49711D3374C95F270DFB19FB02D358C6B12BE241C7D1304A194723","evidencePath":"../../../../docs/records/experiments/2026-09-17-task9-codex-template-evidence.md","verdict":"verified"},"limitsAndTransport":{"evidenceHash":"7F243BBE9E49711D3374C95F270DFB19FB02D358C6B12BE241C7D1304A194723","evidencePath":"../../../../docs/records/experiments/2026-09-17-task9-codex-template-evidence.md","verdict":"verified"},"modelEndpointAllowOnly":{"evidenceHash":"7F243BBE9E49711D3374C95F270DFB19FB02D358C6B12BE241C7D1304A194723","evidencePath":"../../../../docs/records/experiments/2026-09-17-task9-codex-template-evidence.md","verdict":"verified"},"noWorkspaceNoSkillsNoMcp":{"evidenceHash":"7F243BBE9E49711D3374C95F270DFB19FB02D358C6B12BE241C7D1304A194723","evidencePath":"../../../../docs/records/experiments/2026-09-17-task9-codex-template-evidence.md","verdict":"verified"},"resourceAndOutsideStop":{"evidenceHash":"7F243BBE9E49711D3374C95F270DFB19FB02D358C6B12BE241C7D1304A194723","evidencePath":"../../../../docs/records/experiments/2026-09-17-task9-codex-template-evidence.md","verdict":"verified"}},"profileHash":"D25BFBB4C2BCAA3BFCAFD1927610A50CF310BE5FA392AB7847FB5F6595129F38","schemaVersion":3,"transportContrast":{"clientKilled":{"exitCode":null,"stderrKind":"none-client-killed-by-outside"},"exit0":{"exitCode":0,"stderrKind":"empty"},"exit127":{"exitCode":127,"stderrKind":"shell-not-found"},"exit7":{"exitCode":7,"stderrKind":"empty"},"timeout":{"exitCode":null,"stderrKind":"none-client-killed-by-outside"}}}
